{
  "$schema": "https://json-schema.org/draft/2020-12/schema",
  "$id": "https://mavula.io/contracts/domain-events/event-envelope.schema.json",
  "title": "MAVULA Domain Event Envelope",
  "type": "object",
  "additionalProperties": false,
  "required": [
    "event_id",
    "event_type",
    "event_version",
    "occurred_at",
    "tenant_id",
    "aggregate",
    "correlation_id",
    "causation_id",
    "payload",
    "metadata"
  ],
  "properties": {
    "event_id": {
      "type": "string",
      "pattern": "^evt_[0-9a-f]{8}-[0-9a-f]{4}-[1-5][0-9a-f]{3}-[89ab][0-9a-f]{3}-[0-9a-f]{12}$"
    },
    "event_type": {
      "type": "string",
      "pattern": "^[a-z][a-z0-9_]*\\.[a-z][a-z0-9_]*$",
      "maxLength": 120
    },
    "event_version": {
      "type": "integer",
      "minimum": 1
    },
    "occurred_at": {
      "type": "string",
      "format": "date-time",
      "pattern": "Z$"
    },
    "tenant_id": {
      "type": "string",
      "pattern": "^[A-Za-z0-9][A-Za-z0-9_-]{0,127}$"
    },
    "aggregate": {
      "$ref": "#/$defs/aggregate"
    },
    "correlation_id": {
      "type": "string",
      "minLength": 1,
      "maxLength": 128
    },
    "causation_id": {
      "type": "string",
      "minLength": 1,
      "maxLength": 128
    },
    "idempotency_key": {
      "type": "string",
      "minLength": 1,
      "maxLength": 255
    },
    "payload": {
      "type": "object"
    },
    "metadata": {
      "$ref": "#/$defs/metadata"
    }
  },
  "$defs": {
    "aggregate": {
      "type": "object",
      "additionalProperties": false,
      "required": ["type", "id", "version"],
      "properties": {
        "type": {
          "type": "string",
          "pattern": "^[a-z][a-z0-9_]{0,63}$"
        },
        "id": {
          "type": "string",
          "minLength": 1,
          "maxLength": 128
        },
        "version": {
          "type": "integer",
          "minimum": 1
        }
      }
    },
    "metadata": {
      "type": "object",
      "additionalProperties": true,
      "required": ["producer", "data_classification"],
      "properties": {
        "producer": {
          "type": "string",
          "enum": ["ledger-core", "workbench", "settlements", "fengine", "fwk", "fpay"]
        },
        "data_classification": {
          "type": "string",
          "enum": ["public", "internal", "confidential", "restricted"]
        },
        "trace_id": {
          "type": "string",
          "minLength": 1,
          "maxLength": 128
        },
        "schema_uri": {
          "type": "string",
          "format": "uri-reference"
        }
      }
    },
    "money": {
      "type": "object",
      "additionalProperties": false,
      "required": ["amount", "currency"],
      "properties": {
        "amount": {
          "type": "string",
          "pattern": "^-?(0|[1-9][0-9]*)(\\.[0-9]+)?$"
        },
        "currency": {
          "type": "string",
          "pattern": "^[A-Z]{3}$"
        }
      }
    }
  }
}
